source_url,name,ingredients,instructions
https://thepioneerwoman.com/food-cooking/recipes/a38848687/cheeseburger-pie-recipe/,Cheeseburger Pie,"1 tbsp. olive oil&nbsp; | 1 lb. lean ground beef | 1/2 c. &nbsp;chopped yellow onion | 1/2 tsp. kosher salt | 1 tbsp. Worcestershire sauce | Nonstick cooking spray | 2 large eggs | 1 c. whole buttermilk, room temperature | 1 tbsp. salted butter, melted | 1/2 c. all-purpose flour | 1 tsp. baking powder | 1 c. shredded cheddar cheese | Pickle slices, for serving (optional) | Ketchup, for serving&nbsp;(optional) | Burger sauce, for serving&nbsp;(optional)","Preheat the oven to 400°F.&nbsp; | Heat a large skillet over medium heat. Add olive oil, ground beef, onion, and salt. Cook, stirring occasionally, until meat is browned and crumbly and onions are softened, 8 to 10 minutes. Drain any excess fat from the pan, if you like. Add the Worcestershire sauce and cook until absorbed, about 2 minutes more.&nbsp; | Spray a 9-inch pie plate with nonstick cooking spray. Transfer the meat mixture to the pie plate. | Whisk together the eggs, buttermilk, and melted butter in a medium bowl until smooth. Add flour and baking powder; whisk until smooth. Pour over the hamburger mixture in the pie plate.&nbsp; | Sprinkle all over with cheese. Bake until top is browned and center is set, about 25 minutes.&nbsp; |  Serve the pie in slices with pickles, ketchup, and/or burger sauce, if you like.&nbsp;"
https://thepioneerwoman.com/food-cooking/recipes/a65280765/chocolate-chip-cookie-icebox-cake-recipe/,Chocolate Chip Cookie Icebox Cake,"1 (8-ounce) block cream cheese, at room temperature | 1 c. powdered sugar | 1/2 c. malted milk powder | 1 tbsp. vanilla extract | 3 c. heavy whipping cream | 2 (16-ounce) packages supermarket chocolate chip cookies (from the bakery section) | 2 tbsp. mini chocolate chips","In a stand mixer fitted with the paddle attachment, beat the cream cheese on medium speed until smooth, 1 to 2 minutes. Add the powdered sugar, malted milk powder, and vanilla, and beat on low speed until combined, about 30 seconds. Scrape the sides and bottom of the bowl with a rubber spatula. Increase the speed to medium, and beat until smooth, 1 minute more. | Scrape the sides and bottom of the bowl. Add 1 cup of the heavy cream, and beat on low speed until smooth. Add the remaining 2 cups heavy cream, increase the speed to medium-high, and beat until firm peaks form, 3 to 4 minutes. | Spoon ¼ cup of the cream mixture into the bottom of an 8-inch springform pan, smoothing it into a thin, even layer with a spoon or offset spatula. | Top the cream mixture with a single layer of cookies, breaking a few as needed to fit. Spread about 1¼ cups of the cream mixture over the cookies, smoothing it into an even layer. Repeat with another layer of cookies, followed by another 1¼ cups of cream. Repeat the layering process once more. Finish with a final layer of cookies, then spread the remaining cream mixture over the top, swooping it decoratively with a spoon if desired. (You’ll have four layers total.) Sprinkle with the mini chocolate chips. | Refrigerate for at least 4 hours or up to 12 hours. | Run an offset spatula round the outside of the cake and remove the sides of the springform pan. Slice into wedges and serve.&nbsp;"
https://thepioneerwoman.com/food-cooking/recipes/a11723/bbq-meatballs-comfort-food-to-the-max/,BBQ Meatballs,"1 1/2 lb. ground beef | 3/4 c. oats | 1 c. milk | 1/2 c. finely minced onion, divided | 1 1/2 tsp. salt | Plenty of ground black pepper, to taste | 1 c. all-purpose flour | Canola oil, for browning | 1 c. ketchup | 2 tbsp. sugar | 3 tbsp. white vinegar | 2 tbsp. Worcestershire sauce | 1 dash Tabasco","Preheat oven to 350°F. | In a large bowl, combine the ground beef, oats, milk, 3 tablespoons of onion, salt, and pepper. Roll into medium-small balls and place on a baking sheet. Place the sheet in the freezer for 5 minutes. | Remove the meatballs from the freezer and immediately dredge in the flour. | In a skillet, heat a few tablespoons of canola oil over medium heat. | Fry the meatballs until just brown. Place into a baking dish. | In a medium bowl, combine the ketchup, sugar, vinegar, Worcestershire sauce, Tabasco, and remaining 5 tablespoons onion. Pour over the meatballs and bake at for 45 minutes. Serve with egg noodles, mashed potatoes, or crusty French bread."
https://thepioneerwoman.com/food-cooking/recipes/a43660120/tomato-sandwich-recipe/,Tomato Sandwich,"1 c. garlic aioli | 2 tbsp. chopped fresh basil leaves | 12 slices white sandwich bread | 2 lb. heirloom tomatoes | Kosher salt, to taste | Freshly ground black pepper, to taste","In a medium bowl, combine the garlic aioli with the basil. Spread the mixture on one side of all the bread slices (there may be some leftover spread).&nbsp; | Slice the tomatoes into 1/4-inch slices. Place the slices on the aioli side of 6 slices of bread, overlapping as necessary. Season the tomatoes with salt and pepper. Place the other 6 slices of bread, aioli side down, on the tomatoes.&nbsp; | Serve immediately."
https://thepioneerwoman.com/food-cooking/recipes/a65380743/corn-and-zucchini-pasta-recipe/,Corn and Zucchini Pasta,"1 tsp. kosher salt, plus more for the pasta water | 1 lb. medium pasta shells | 2 tbsp. olive oil | 4 ears of corn, kernels removed (about 3 cups) | 2 medium zucchini, sliced into 1/4-inch-thick half moons | 4 garlic cloves, finely chopped | 1/2 tsp. black pepper | 1/2 tsp. red pepper flakes, plus more for topping | 1 c. low-sodium chicken or vegetable broth | 1 c. grated parmesan cheese (about 4 ounces), plus more for topping | 1 (5.3-ounce) package garlic-and-herb cheese (such as Boursin), sliced and at room temperature | Grated zest and juice of 1 lemon | 2 tbsp. chopped fresh chives, plus more for topping","Bring a large pot of salted water to a boil. Add the pasta and cook according to the package directions. Drain, reserving ½ cup cooking water.&nbsp; | Meanwhile, heat the olive oil in a large skillet or Dutch oven over medium-high heat. Add the corn and zucchini and cook, without stirring, until the vegetables begin to turn golden brown, 5 to 7 minutes. Reduce the heat to medium and stir in the garlic, black pepper, red pepper flakes, and 1 teaspoon salt. Cook until fragrant, about 1 minute. | Add the chicken broth to the skillet and&nbsp;cook for 1 minute, scraping the&nbsp;bottom of the pan with a wooden&nbsp;spoon. Reduce the heat to low and stir&nbsp;in the parmesan, garlic-and-herb&nbsp;cheese, lemon zest, and lemon juice.&nbsp; | Fold in the pasta and chives, loosening&nbsp;the sauce with a few splashes of the&nbsp;reserved cooking water if necessary.&nbsp;Serve topped with more parmesan,&nbsp;red pepper flakes, and chives."
https://thepioneerwoman.com/food-cooking/recipes/a61488193/pork-burgers-recipe/,Pork Burgers,"1/2 c. grated onion (about 1 small onion grated on the large holes of a box grater) | 1/4 c. plain breadcrumbs | 2 tbsp. milk | 1 tbsp. Worcestershire sauce | 1 tbsp. kosher salt | 1 tsp. black pepper | 1/2 tsp. ground sage | 1 1/2 lb. ground pork | 8 slices bacon, finely chopped (about 6 oz.) | 1 tbsp. vegetable oil, for the grill grates or pan | 6 slices provolone or your favorite cheese (about 4 oz.; optional) | 6 burger buns, split and toasted | Romaine lettuce leaves, sliced tomato, sliced red onion, dill pickles, ketchup, mustard, and mayonnaise, for topping","In a large bowl, combine the onion, breadcrumbs, milk, Worcestershire sauce, salt, pepper, and sage. Let sit until the liquid is fully absorbed, about 5 minutes. Gently mix the pork and bacon into the breadcrumb mixture. | Divide the mixture into 6 balls (about 6 ounces each), being careful not to overwork the meat. Press into 1-inch thick patties (about 4 ½-inch rounds). | Preheat the grill to medium-high heat, 400°F to 425°F.  | Oil the grill grates with the vegetable oil. Grill the patties over direct heat, covered, until the internal temperature reads 165°F, 5 to 6 minutes per side. If you like cheese on your burgers, add it during the last minute of cooking, then cover to melt.<br> | Alternatively, cook on the stovetop: Heat the vegetable oil in a large cast-iron skillet or grill pan over medium-high heat. Working in batches as necessary, cook the patties until the bottoms are golden and crusty, 5 to 6 minutes. Flip, and cook until the internal temperature of the patties reads 165°F, about 3 minutes more. If you like cheese on your burgers, add it during the last minute of cooking, then cover to melt.&nbsp; | Serve the burgers on the toasted buns with desired toppings."
