source_url,name,ingredients,instructions
https://www.bonappetit.com/recipe/zucchini-fries,Zucchini Fries With Herby Yogurt Dip,"2 large zucchini (about 1¼ lb.), trimmed | Zest of 1 lemon, plus more for serving | ½ cup labneh or plain whole-milk Greek yogurt | ¼ cup finely chopped tender herbs (such as dill, parsley, and/or basil), plus more for serving | 1½ tsp. plus 1 Tbsp. Diamond Crystal or 2¾ tsp. kosher salt, divided, plus more | Freshly ground pepper | ¾ cup all-purpose flour | 3 large eggs | 1½ cups panko | 1½ oz. Parmesan, finely grated (about ¾ cup) | 2¼ tsp. dried oregano | 2¼ tsp. garlic powder | Vegetable oil (2–3 cups if frying; ½ cup if baking) or nonstick vegetable oil spray (if air-frying) | A deep-fry thermometer (optional)","Cut 2 large zucchini (about 1¼ lb.), trimmed, in half crosswise. Cut each section in half lengthwise to get four quarters. Halve each quarter lengthwise to create 16 sticks total. | Stir zest of 1 lemon, ½ cup labneh or plain whole-milk Greek yogurt, ¼ cup finely chopped tender herbs (such as dill, parsley, and/or basil), 1 tsp. Diamond Crystal or ½ tsp. Morton kosher salt, a large pinch of freshly ground pepper, and 2 Tbsp. water in a small bowl until smooth. Cover herby yogurt and chill. | Whisk ¾ cup all-purpose flour and ¼ tsp. Diamond Crystal or Morton kosher salt in a shallow bowl to combine. Lightly whisk 3 large eggs and ¼ tsp. Diamond Crystal or Morton kosher salt in another shallow bowl. Place 1½ cups panko in a third shallow bowl. Using your hands or a measuring cup, crush panko into slightly finer pieces (you don’t need an even consistency, just some finer and coarser bits). Add 1½ oz. Parmesan, finely grated (about ¾ cup), 2¼ tsp. dried oregano, 2¼ tsp. garlic powder, 1 Tbsp. Diamond Crystal or 1¾ tsp. Morton kosher salt, and a large pinch of freshly ground pepper to panko; mix to combine. | Working with a few pieces at a time, dredge zucchini sticks in flour, shaking off excess. Dip in egg, letting excess drip back into bowl, then coat in panko mixture, pressing gently to adhere. Transfer to a wire rack set inside large rimmed baking sheet. | If frying: Pour vegetable oil into a medium high-sided skillet fitted with thermometer to come ¾"" up sides (2–3 cups) and heat over medium-high until thermometer registers 350°. Working in batches and bringing oil back up to 350° between batches, fry zucchini in a single layer, turning occasionally, until golden brown and crisp on all sides, about 3 minutes. Transfer zucchini fries back to wire rack; lightly season with salt.
If baking: Place a rack in lower third of oven and set a rimmed baking sheet on rack; preheat to 400°. When oven is hot (or after 10 minutes), carefully pour ½ cup vegetable oil onto hot baking sheet, carefully tilting baking sheet to coat evenly. Arrange zucchini, flat side down, on baking sheet in a single layer. Bake, turning halfway through, until golden brown and crisp, 30–35 minutes. Lightly season zucchini fries with salt.
If air-frying: Heat air fryer to 400°. Generously coat air fryer basket with nonstick vegetable oil spray. Working in batches if needed, arrange zucchini in basket in a single layer and cook until golden brown and crisp on top, 6–8 minutes. Turn zucchini and coat with nonstick spray. Cook until brown and crisp on other side 6–8 minutes. Lightly season zucchini fries with salt. | Transfer zucchini fries to a large plate or platter. Uncover herby yogurt and top with more herbs and lemon zest. Serve with zucchini fries for dipping."
https://www.bonappetit.com/recipe/pork-dinakdakan,Pork Dinakdakan,"3 red or green Thai chiles, halved lengthwise, thinly sliced | 10 garlic cloves, coarsely chopped | ½ cup apple cider vinegar | ½ cup soy sauce | 3 Tbsp. sugar | 4 dried bay leaves | 1 large red onion, thinly sliced, divided | 2 lb. skinless pork belly, sliced ¾"" thick | 1 Tbsp. vegetable oil; plus 2 tsp. if pan-searing (optional) | 6 oz. shishito peppers | 1 Tbsp. fish sauce | 1 ¾"" piece ginger, peeled, finely chopped | Steamed white rice (for serving; optional)","Whisk 3 red or green Thai chiles, halved lengthwise, thinly sliced, 10 garlic cloves, coarsely chopped, ½ cup apple cider vinegar, ½ cup soy sauce, and 3 Tbsp. sugar in a small bowl to combine. Set ¼ cup dressing aside. Place remaining dressing in a medium Dutch oven or other heavy pot. Add 4 dried bay leaves, ½ large red onion, thinly sliced, and 3 cups water, then add 2 lb. skinless pork belly, sliced ¾"" thick (it should be mostly submerged). Cover pot and set over medium heat. Bring to a simmer. Cook, adjusting heat as needed, until meat is tender (a chopstick inserted into the pork belly should meet with no resistance), 60–75 minutes. | Remove pork belly from pot and let sit until cool enough to handle. Pat with paper towels to remove as much moisture as possible. | Heat 1 Tbsp. vegetable oil in a large skillet over medium. Cook 6 oz. shishito peppers, tossing occasionally, until softened and blistered, 5–7 minutes. Transfer to a large bowl. | If pan-searing, add 2 tsp. vegetable oil to same pan. Cook pork, turning halfway through, until golden brown, about 6 minutes. | If grilling, prepare a grill for medium heat. Grill pork, turning halfway through, until crisp and golden brown, about 6 minutes. | Transfer pork belly to a cutting board and let cool slightly, then cut into bite-size pieces. Transfer to bowl with shishito peppers; add 1 Tbsp. fish sauce, one ¾"" piece ginger, peeled, finely chopped, remaining ½ large red onion, thinly sliced, and reserved dressing and toss to combine. Arrange on a platter and serve with steamed white rice if desired."
https://www.bonappetit.com/recipe/spicy-eggplant-frittata,Spicy Eggplant Frittata,"1 lb. Japanese eggplants (about 4 medium) | 4 Tbsp. unsalted butter, divided | 2 tsp. Diamond Crystal or 1¼ tsp. Morton kosher salt, divided | 6 large eggs | ½ cup whole milk | 2 tsp. cornstarch | 1 medium red onion, finely chopped | ½ bunch cilantro, finely chopped (including stems), plus leaves with tender stems for serving | 1 serrano chile or jalapeño, halved, thinly sliced | Steamed white rice or toasted bread and ketchup (for serving; optional)","Place a rack in middle of oven; preheat to 325°. Trim tops off 1 lb. Japanese eggplants (about 4 medium) and halve lengthwise; discard tops. Cut halves lengthwise into 4 strips each. Cut strips crosswise to make 3""-long pieces. | Heat 1 Tbsp. unsalted butter in a large nonstick skillet over medium-high. Add half of the eggplant and ¼ tsp. Diamond Crystal or Morton kosher salt. Cook, stirring occasionally with a heatproof rubber spatula, until golden brown and tender, 6–8 minutes. Transfer to a plate. Repeat with 1 Tbsp. unsalted butter, ¼ tsp. Diamond Crystal or Morton kosher salt, and remaining eggplant, leaving in pan. | Meanwhile, whisk 6 large eggs, ½ cup whole milk, 2 tsp. cornstarch, and remaining 1½ tsp. Diamond Crystal or ¾ tsp. Morton kosher salt in a medium bowl. Add 1 medium red onion, finely chopped, ½ bunch cilantro, finely chopped (including stems), and 1 serrano chile or jalapeño, halved, thinly sliced, and stir to combine. | Return all of the eggplant to skillet, add remaining 2 Tbsp. unsalted butter, and stir until melted. Pour egg mixture over eggplant, reduce heat to medium-low, and cook, scraping and stirring, until egg mixture is half set, about 5 minutes. Smooth surface and transfer pan to oven. Bake frittata until puffed and just set (it should wobble slightly in the center when gently shaken), 8–10 minutes. Let cool 5 minutes. | Scatter cilantro leaves with tender stems over frittata. Run a small offset spatula around sides to loosen and cut into wedges. Serve with steamed white rice or toasted bread and ketchup if desired."
https://www.bonappetit.com/recipe/juicy-bison-burger-with-cucumber-red-onion-slaw,Juicy Bison Burger With Cucumber–Red Onion Slaw,"½ cup mayonnaise | 1 Tbsp. finely grated lemon zest | 4 Tbsp. fresh lemon juice, divided | Kosher salt | 1 large English hothouse cucumber or 4 Persian cucumbers (about 8 oz.) | 1 small red onion, thinly sliced | 1 Tbsp. finely chopped mint | 1 Tbsp. finely chopped parsley | 2 tsp. white wine vinegar | 1 tsp. sugar | 1 tsp. freshly ground pepper, plus more | 1 Tbsp. granulated garlic | 1 Tbsp. smoked paprika | 2 tsp. ground cumin | 1 lb. ground bison | 4 hamburger buns, split | 1 Tbsp. extra-virgin olive oil, plus more for spatula","Mix ½ cup mayonnaise, 1 Tbsp. finely grated lemon zest, and 1 Tbsp. fresh lemon juice in a small bowl; season with kosher salt. Set lemon mayo aside. | Using a vegetable peeler, peel down entire length of 1 large English hothouse cucumber or 4 Persian cucumbers (about 8 oz.) to make long thin strips, working on one side until cucumber becomes difficult to peel in the center, then turning onto flat side and repeating on other side. Transfer ribbons to a medium bowl and add 1 small red onion, thinly sliced, 1 Tbsp. finely chopped mint, 1 Tbsp. finely chopped parsley, 2 tsp. white wine vinegar, 1 tsp. sugar, and remaining 3 Tbsp. fresh lemon juice; toss to combine. Season slaw with salt and freshly ground pepper and toss again. Let sit while you make the patties. | Mix 1 Tbsp. granulated garlic, 1 Tbsp. smoked paprika, 2 tsp. ground cumin, and 1 tsp. freshly ground pepper in a small bowl. Divide 1 lb. ground bison into 4 equal pieces and form into ¼""-thick patties. Sprinkle all over with spice mixture and season generously with salt. | Heat a large cast-iron skillet over medium-high. Working in 2 batches, toast 4 hamburger buns, split, cut side down, until golden and crisp around edges, 1–2 minutes. Transfer to plates. | Drizzle 1 Tbsp. extra-virgin olive oil into same pan; swirl to coat bottom. Working in batches if needed, arrange patties in pan and immediately press down on each one with a spatula coated in oil for a few seconds to maintain their thinness. Cook until deeply browned underneath, about 2 minutes. Flip patties and cook until deeply browned on other sides, about 2 minutes for medium-rare. Transfer patties to a plate; let rest 5 minutes. | Spread reserved lemon mayo over bottom half of each toasted bun. Top each with a patty and mound some slaw over. Close up burgers."
https://www.bonappetit.com/recipe/bicycle-bandit,Bicycle Bandit,1 oz. gin | ½ oz. Campari | Grapefruit soda (such as San Pellegrino Pompelmo; for serving) | Lemon wedge (for serving),Stir 1 oz. gin and ½ oz. Campari in a tall glass filled with ice until cold. Top off with grapefruit soda and garnish with lemon wedge.
https://www.bonappetit.com/recipe/grilled-purple-sweet-potato-salad,Grilled Purple Sweet Potato Salad,"2 lb. purple sweet potatoes, peeled | ½ tsp. Diamond Crystal or ¼ tsp. Morton kosher salt, plus more | 1 Tbsp. white sesame seeds, plus more for serving | 1 garlic clove, finely grated | ½ cup mayonnaise | 1 Tbsp. finely grated lemon zest | 1 Tbsp. soy sauce | 1 tsp. freshly ground pepper | 1 tsp. sugar | 1 tsp. toasted sesame oil | 2 Tbsp. extra-virgin olive oil | Thinly sliced scallions (for serving)","Place 2 lb. purple sweet potatoes, peeled, in a large pot and pour in water to cover. Season with kosher salt and bring to a simmer; cook until almost tender, 18–25 minutes. Drain and let sit until dry and cool enough to handle. Slice in half lengthwise and place on a rimmed baking sheet. | Meanwhile, toast 1 Tbsp. white sesame seeds in a dry small skillet over medium, stirring occasionally, until deep golden brown, 5–7 minutes. Transfer to a mortar and pestle and let cool. Coarsely crush sesame seeds. (Alternatively, you can smash with the side of a chef’s knife or with a heavy skillet.) | Stir together 1 garlic clove, finely grated, ½ cup mayonnaise, 1 Tbsp. finely grated lemon zest, lemon juice, 1 Tbsp. soy sauce, 1 tsp. freshly ground pepper, 1 tsp. sugar, 1 tsp. toasted sesame oil, ½ tsp. Diamond Crystal or ¼ tsp. Morton kosher salt, and crushed sesame seeds in a small bowl. | Prepare a grill for medium-high heat. Drizzle 2 Tbsp. extra-virgin olive oil over sweet potatoes, season with salt, and turn to coat. Grill, cut sides down, until deeply charred underneath, 8–10 minutes. | Transfer sweet potatoes to a platter, arranging cut sides up. Using a fork, lightly crush. Spoon dressing over and top with sesame seeds and thinly sliced scallions."
https://www.bonappetit.com/recipe/jalapeno-popper-skillet-tacos,Jalapeño Popper Skillet Tacos,"12 oz. pepper jack cheese, coarsely grated (about 3 cups), divided | 4 tsp. all-purpose flour | 1 medium red onion, cut into 1""-thick wedges, layers separated | 4 medium poblano chiles, halved, ribs and seeds removed, cut into 1""-wide strips | 3 jalapeños, thinly sliced into strips | Extra-virgin olive oil (for drizzling) | Kosher salt | 8 oz. cream cheese, room temperature, cut into large pieces | Freshly ground pepper | Small flour tortillas, cilantro leaves with tender stems, and lime wedges (for serving)","Place a rack in upper third of oven; preheat to 450°. Set 1 cup coarsely grated pepper jack cheese aside. Place remaining 2 cups coarsely grated pepper jack cheese in a large bowl, add 4 tsp. all-purpose flour, and toss until completely coated. | Place 1 medium red onion, cut into 1""-thick wedges, layers separated, 4 medium poblano chiles, halved, ribs and seeds removed, cut into 1""-wide strips, and 3 jalapeños, thinly sliced into strips, in a medium ovenproof skillet. Drizzle lightly with extra-virgin olive oil and season with kosher salt; toss to coat. Roast in oven until tender and blistered in spots, 20–25 minutes. Remove from oven and heat broiler (on high if your oven has options). | Meanwhile, heat ½ cup water in a medium saucepan over medium-high until starting to bubble at the edges. Reduce heat to medium, then add 8 oz. cream cheese, room temperature, cut into large pieces, and cook, whisking constantly, until smooth and combined, about 1 minute. Add coated pepper jack cheese and cook, whisking constantly and vigorously, until cheese is melted and sauce is smooth and homogeneous, about 3 minutes. (Sauce will thicken as it cools; reheat briefly, whisking, before the next step if needed.) | Pour sauce over onion mixture. Sprinkle reserved pepper jack cheese on top. Broil until bubbling and blistered in spots, about 3 minutes. Season with freshly ground pepper. | Serve cheesy onion mixture with small flour tortillas, cilantro leaves with tender stems, and lime wedges for building tacos."
https://www.finedininglovers.com/explore/recipes/carolina-gold-rice-pudding-strawberry-anise-hyssop-jam,Carolina Gold Rice Pudding with Strawberry–Anise Hyssop Jam,FOR THE RICE PUDDING | Carolina Gold rice | Full fat coconut milk | Almond milk | Sugar | Salt | Vanilla bean | FOR THE STRAWBERRY–ANISE HYSSOP JAM | Anise hyssop leaves | Sugar | Water | Strawberries | Salt | Lemon juice | Lemon juice | FOR SERVING | Fresh shiso or mint leaves,Fill a large pot with water and bring to a boil. Add the rice and cook for 18–20 minutes  or until fully cooked.While the rice cooks  combine the coconut milk  almond milk  sugar  salt  vanilla bean seeds  and pod in a separate large pot. Gently warm over low–medium heat  stirring to dissolve the sugar.Once the rice is cooked  strain out any remaining water.Add the rice to the warmed milk mixture. Cook over low heat for about 20 minutes  or until the mixture thickens and the rice is very soft.Transfer the rice pudding to a bowl  remove the vanilla pod  and chill in the refrigerator for at least 2 hours.  minimal_rich_text | Preheat the oven to 400°F.In a small pot over medium heat  combine the sugar and water. Stir until the sugar fully dissolves.Remove from heat  add the anise hyssop leaves  and let steep for 15 minutes. Strain out the leaves and reserve the syrup.Wash  de-stem  and quarter the strawberries.In a medium saucepan  combine the strawberries with 60 ml of the hyssop syrup and the salt. Place the pan in the oven.Roast for 15 minutes. Remove the strawberries  stir gently with a rubber spatula  and return to the oven. After 10 more minutes  check for doneness: the strawberries should hold their shape  and the liquid should be thickened but not puréed. Adjust with more syrup if desired and return to the oven if needed.Once finished  transfer the jam to a bowl and stir in the lemon juice. Let cool to room temperature.  minimal_rich_text | Divide the chilled rice pudding into bowls.Spoon the strawberry–anise hyssop jam around the pudding.Tear the shiso or mint leaves and garnish each bowl.  minimal_rich_text
https://www.finedininglovers.com/explore/recipes/yuca-fries,Yuca Fries,Yuca root | Vegetable oil | Salt,Peel the yuca root carefully using a knife and cut into large chunks. Remove the inner core of the root.   minimal_rich_text | Boil a large pot of salted water. Add the yuca and simmer for 20 minutes or until fork-tender. Drain the yuca root.   minimal_rich_text | Cut the yuca root into thick rectangular wedges. Heat the vegetable oil in a frying pan over medium heat. Once the oil has reached 350°F  fry the yuca root in batches until golden brown. Remove the yuca root using a slotted spoon and place on a paper towel.   minimal_rich_text | Sprinkle the fried yuca with salt to taste  and serve hot from the frying pan.   minimal_rich_text
https://www.finedininglovers.com/explore/recipes/apple-tarte-recipe-chef-michael-michaelidis,Apple Tarte Recipe by Chef Michaël Michaelidis,Puff pastry | Granny Smith apples | Melted butter | Sugar | Cinnamon | Bourbon vanilla ice cream | Nougat de Montélimar | Calissons d’Aix-en-Provence | Coffee and tea,Preheat the oven to 375°F.Lay the puff pastry sheet on a parchment-lined baking tray.Arrange the apple slices in a fan pattern over the pastry.  minimal_rich_text | Brush the apples with melted butter. Sprinkle evenly with the sugar and cinnamon mixture.  minimal_rich_text | Bake for 25 to 30 minutes  until the pastry is golden brown and the apples are tender.  minimal_rich_text | Serve the tart warm with a scoop of bourbon vanilla ice cream.Add nougat and calissons alongside  with coffee or tea.  minimal_rich_text
https://www.finedininglovers.com/explore/recipes/roasted-oysters-scallion-kimchi-butter-and-rhubarb-mignonette,Roasted Oysters with Scallion Kimchi Butter and Rhubarb Mignonette,Oysters | FOR THE SCALLION KIMCHI BUTTER | Scallions | Olive oil | Kimchi paste | Room temperature unsalted butter | Lemons | Salt | Gochugaru or other chili flakes | FOR THE RHUBARB MIGNONETTE | Rhubarb | Rice wine vinegar | Water | Shallot | Lemon juice | Salt and freshly cracked black pepper,Lightly drizzle the olive oil over the scallions. On a hot grill or cast iron pan  cook the whole scallions on one side until they develop a nice char  4–6 minutes. Turn them over and cook on the other side until fully tender. Remove scallions from heat and let cool. Once cool  cut them into 2.5 cm pieces  discarding the roots.In a food processor  combine the cooked scallions with the kimchi paste. Process until no large pieces remain.In the bowl of a stand mixer  combine the butter  scallion kimchi purée  lemon zest  salt  and gochugaru. Start the mixer on low speed to combine  then gradually increase to medium-high speed until fully incorporated.Transfer the butter to a piping bag and keep it at room temperature.  minimal_rich_text | Place the minced rhubarb in a small mixing bowl.In a small pot over high heat  bring the rice wine vinegar and water to a boil.Pour the hot liquid over the rhubarb and let sit for 10 minutes.Add the minced shallot  lemon juice  salt  and black pepper. Set aside.  minimal_rich_text | Turn the grill to high  or preheat the oven to 450°F.Prepare a baking sheet by covering it with foil  gently scrunched to create a surface that holds the oysters steady.Place the oysters on the foil. Snip the tip of the piping bag and top each oyster with about 1 teaspoon of the scallion kimchi butter (more if the oysters are large).Grill with the lid closed or bake until the butter melts and the oysters are warmed through  about 2–4 minutes.Carefully remove the oysters from the grill or oven. Serve with the rhubarb mignonette and eat immediately.  minimal_rich_text
https://www.finedininglovers.com/explore/recipes/oyakodon,Oyakodon,FOR THE SAUCE | Dashi | Sake | Dark soy sauce | Mirin | FOR THE OYAKO | Chicken thighs | White onion | Garlic clove | Ginger | Eggs | Scallion | Japanese rice | Raw egg,In a 20 cm (7–8 inch) sauté pan over medium heat  combine the sauce ingredients with the chicken  white onion  garlic  and ginger.Cook  stirring occasionally  until the liquid reduces to about 3 tablespoons.Crack the eggs directly into the pan. Reduce heat to low  cover with a lid  and cook for 30 seconds to 1 minute  until the eggs are just barely set  sunny-side up style.Gently ladle the entire mixture over a bowl of cooked rice  keeping the eggs soft and runny.Top with chopped scallion and  if desired  an additional raw egg.  minimal_rich_text
https://www.finedininglovers.com/explore/recipes/loup-de-mer-carpaccio-chef-michael-michaelidis,Loup de Mer Carpaccio by Chef Michaël Michaelidis,Loup de Mer | Zest of 1 lime | Zest of 1 lemon | Zest of 1 orange | Juice of 1/2 lemon | Juice of 1/2 orange | Provençal extra virgin olive oil | Fleur de sel | Freshly cracked white pepper | Microgreens or baby basil,Using a very sharp knife  slice the Loup de Mer as thinly as possible. Arrange the slices in a single layer on a chilled serving plate.In a small bowl  combine the citrus juices and olive oil. Drizzle evenly over the fish.Sprinkle the fish with the citrus zest  fleur de sel  and white pepper.Garnish with microgreens or baby basil.Let the carpaccio rest for 5 minutes to allow the flavors to meld. Serve immediately.  minimal_rich_text
https://www.finedininglovers.com/explore/recipes/grilled-lamb-chops-provencal-recipe-chef-michael-michaelidis,Grilled Lamb Chops Provençal Recipe by Chef Michaël Michaelidis,FOR THE LAMB AND MARINADE | French lamb chops | Garlic cloves | Rosemary | Thyme | Zest of 1 lemon | Olive oil | FOR THE VEGETABLES | Zucchini | Eggplant | Red pepper | Cherry tomatoes | Olive oil | Salt | Herbes de Provence | FOR THE JUS | Lamb stock | Rosemary | Dry white wine,Combine the garlic  rosemary  thyme  lemon zest  and olive oil in a bowl. Rub the mixture over the lamb chops. Cover and marinate in the refrigerator for at least 4 hours.  minimal_rich_text | Preheat the grill to medium-high. Grill the lamb chops for about 3–4 minutes per side until medium rare. Let rest for 5 minutes before serving.  minimal_rich_text | Slice the zucchini  eggplant  and red pepper as desired. Toss with olive oil  salt  and herbes de Provence. Grill the vegetables until lightly charred.  minimal_rich_text | In a small saucepan  combine the lamb stock  rosemary  and white wine. Bring to a simmer and reduce until slightly thickened.  minimal_rich_text | Arrange the lamb chops on plates with the grilled vegetables.Drizzle the jus over and around the meat.  minimal_rich_text
https://thepioneerwoman.com/food-cooking/recipes/a65162388/fried-green-tomato-caprese-recipe/,Fried Green Tomato Caprese,"Vegetable oil, for frying | 1/2 c. all-purpose flour | 2 tsp. seasoning salt (such as Lawry's) | 2 to 3 large eggs | 1 1/2 c. panko breadcrumbs | 3 large green tomatoes, cut into 1/4-inch-thick slices | Flaky sea salt, to taste | Black pepper, to taste | 12 oz. fresh mozzarella, thickly sliced | 1/4 c. balsamic glaze | Large bunch fresh basil leaves, for serving","Add an inch of vegetable oil to a large heavy skillet and heat to 350°F on a deep-fry thermometer. | Mix the flour and seasoning salt in a shallow dish. Add 2 eggs to a second shallow dish and beat together. Add the panko to a third shallow dish. | Dredge a few tomato slices in the seasoned flour, then dip them in the egg, and lastly cover them in the panko. Set aside on a plate and repeat with the remaining tomato slices. Beat an additional egg into the shallow dish if necessary. | Working in batches, fry the tomatoes until golden and crisp, about 2 minutes per batch. Drain on a paper towel-lined plate and sprinkle with flaky sea salt and pepper. | When you are ready to assemble the salad, season the mozzarella slices with flaky sea salt and pepper. Shingle the fried tomatoes and mozzarella on a platter, alternating between the two. Drizzle over the balsamic glaze in a thin stream, then sprinkle over the basil leaves."
